{
  "schema_id": "GateResultSetV1",
  "schema_version": "1.0.0",
  "candidate_key": {
    "candidate_id": "cand-inference-vi-01",
    "candidate_version": "1",
    "source_term": "inference",
    "candidate_vi": "suy luận",
    "sense_id": "model_execution",
    "scope_id": "machine_learning",
    "sense_inventory_version": "sense-v1",
    "dataset_manifest_sha256": "1111111111111111111111111111111111111111111111111111111111111111",
    "effective_sense_contract_sha256": "82eedc4661ad441fd7e1925b61738b3ad97af9c2eacb9ce99f2209b45fe1dd0b"
  },
  "input_contract_sha256": "ad9888fdb98fba49d6a7b50f30d8749694e28c89a5dd3f7fdea0ae490ccdf704",
  "gate_policy_version": "gates-v1",
  "observations": [
    {
      "gate_id": "wrong_sense",
      "triggered": false,
      "action": "NONE",
      "reason_codes": [],
      "evidence_refs": []
    },
    {
      "gate_id": "insufficient_evidence",
      "triggered": false,
      "action": "NONE",
      "reason_codes": [],
      "evidence_refs": []
    }
  ],
  "integrity": {
    "self_sha256": "77879fc95231662c0500547ad70710767c1cb98a7841f45f883a730aaeecf86b"
  }
}
